{
  "actionState": {
    "id": "897998c8-a417-44b6-9e7d-3e0b21ceb9e7",
    "state": "RUNNING",
    "timestamp": "2025-10-01T09:36:24.083957Z",
    "command": "DOCK"
  },
  "serialNumber": "5iO4",
  "waitingForLoadHandling": false,
  "timestamp": "2025-10-01T09:36:24.084308Z",
  "actionStates": [
    {
      "id": "897998c8-a417-44b6-9e7d-3e0b21ceb9e7",
      "state": "RUNNING",
      "timestamp": "2025-10-01T09:36:24.083957Z",
      "command": "DOCK"
    }
  ],
  "lastNodeSequenceId": 0,
  "orderId": "5e75ef1f-6091-4ec0-b71c-4d54968593f9",
  "edgeStates": [],
  "load": [],
  "lastNodeId": "SVR4H73275",
  "nodeStates": [],
  "headerId": 307,
  "driving": true,
  "orderUpdateId": 0,
  "errors": [],
  "lastCode": "",
  "paused": false,
  "batteryState": {
    "charging": false,
    "maxVolt": 9.1,
    "minVolt": 7.84,
    "percentage": 76,
    "currentVoltage": 8.8
  }
}