{
  "actionState": {
    "id": "045c08f2-dc8a-4bfc-923c-6aaacd60237a",
    "state": "INITIALIZING",
    "timestamp": "2025-10-01T09:38:37.705562Z",
    "command": "DOCK"
  },
  "serialNumber": "5iO4",
  "waitingForLoadHandling": false,
  "timestamp": "2025-10-01T09:38:37.706464Z",
  "actionStates": [
    {
      "id": "045c08f2-dc8a-4bfc-923c-6aaacd60237a",
      "state": "INITIALIZING",
      "timestamp": "2025-10-01T09:38:37.705562Z",
      "command": "DOCK"
    }
  ],
  "lastNodeSequenceId": 0,
  "orderId": "d41940cc-356f-4c98-8352-d57c039b9b8e",
  "edgeStates": [],
  "load": [
    {
      "loadType": null,
      "loadId": null,
      "loadPosition": "1"
    }
  ],
  "lastNodeId": "SVR3QA0022",
  "nodeStates": [],
  "headerId": 324,
  "driving": true,
  "orderUpdateId": 0,
  "errors": [],
  "lastCode": "",
  "paused": false,
  "batteryState": {
    "charging": false,
    "maxVolt": 9.1,
    "minVolt": 7.84,
    "percentage": 76,
    "currentVoltage": 8.8
  }
}