{
  "actionState": {
    "id": "06d04f01-df74-4fda-a77b-2718c9dd9947",
    "state": "FINISHED",
    "timestamp": "2025-10-01T09:40:23.012289Z",
    "command": "DOCK"
  },
  "serialNumber": "5iO4",
  "waitingForLoadHandling": false,
  "timestamp": "2025-10-01T09:40:48.514030Z",
  "actionStates": [
    {
      "id": "bddbbd1f-afa3-491e-9bbc-ecff1cd8de87",
      "state": "FINISHED",
      "timestamp": "2025-10-01T09:40:08.577022Z",
      "command": "TURN"
    },
    {
      "id": "52442406-6770-40ae-97ae-4f5f8a0fd7cd",
      "state": "FINISHED",
      "timestamp": "2025-10-01T09:40:13.730341Z",
      "command": "TURN"
    },
    {
      "id": "1f355918-e8fe-4b49-8c7e-70880a3c79ab",
      "state": "FINISHED",
      "timestamp": "2025-10-01T09:40:17.342273Z",
      "command": "TURN"
    },
    {
      "id": "06d04f01-df74-4fda-a77b-2718c9dd9947",
      "state": "FINISHED",
      "timestamp": "2025-10-01T09:40:23.012289Z",
      "command": "DOCK"
    },
    {
      "id": "4fb07a21-b604-41bb-b8a2-df5dbddae929",
      "state": "FINISHED",
      "timestamp": "2025-10-01T09:40:31.435998Z",
      "command": "clearLoadHandler"
    },
    {
      "id": "fd9018e8-8390-4fd3-815a-97523ee179fa",
      "state": "FINISHED",
      "timestamp": "2025-10-01T09:40:48.513622Z",
      "command": "clearLoadHandler"
    }
  ],
  "lastNodeSequenceId": 0,
  "orderId": "d41940cc-356f-4c98-8352-d57c039b9b8e",
  "edgeStates": [],
  "load": [
    {
      "loadType": "WHITE",
      "loadId": "047b8bca341291",
      "loadPosition": "1"
    }
  ],
  "lastNodeId": "SVR4H76530",
  "nodeStates": [],
  "headerId": 372,
  "driving": false,
  "orderUpdateId": 6,
  "errors": [],
  "lastCode": "",
  "paused": false,
  "batteryState": {
    "charging": false,
    "maxVolt": 9.1,
    "minVolt": 7.84,
    "percentage": 76,
    "currentVoltage": 8.8
  }
}