{
  "actionState": {
    "id": "80d11088-e361-4617-b04f-d946e900f313",
    "state": "FINISHED",
    "timestamp": "2025-10-01T09:39:33.904681Z",
    "command": "DOCK"
  },
  "serialNumber": "5iO4",
  "waitingForLoadHandling": false,
  "timestamp": "2025-10-01T09:39:45.082628Z",
  "actionStates": [
    {
      "id": "c553bbb5-0f28-4dfc-8fa7-32cd5fddce9b",
      "state": "FINISHED",
      "timestamp": "2025-10-01T09:39:24.236023Z",
      "command": "TURN"
    },
    {
      "id": "1077bdc0-e9cf-4c87-8145-e177dbfeaa70",
      "state": "FINISHED",
      "timestamp": "2025-10-01T09:39:27.856492Z",
      "command": "TURN"
    },
    {
      "id": "80d11088-e361-4617-b04f-d946e900f313",
      "state": "FINISHED",
      "timestamp": "2025-10-01T09:39:33.904681Z",
      "command": "DOCK"
    },
    {
      "id": "784fcbdb-2aea-40ae-9431-a4f95d610ebe",
      "state": "FINISHED",
      "timestamp": "2025-10-01T09:39:45.082285Z",
      "command": "clearLoadHandler"
    }
  ],
  "lastNodeSequenceId": 0,
  "orderId": "d41940cc-356f-4c98-8352-d57c039b9b8e",
  "edgeStates": [],
  "load": [
    {
      "loadType": null,
      "loadId": null,
      "loadPosition": "1"
    }
  ],
  "lastNodeId": "SVR4H76449",
  "nodeStates": [],
  "headerId": 346,
  "driving": false,
  "orderUpdateId": 2,
  "errors": [],
  "lastCode": "",
  "paused": false,
  "batteryState": {
    "charging": false,
    "maxVolt": 9.1,
    "minVolt": 7.84,
    "percentage": 76,
    "currentVoltage": 8.8
  }
}